{
  "key": "api-search-without-term",
  "qaseId": null,
  "title": "Search without the search_product parameter is a bad request",
  "suite": "API / Catalog",
  "layer": "api",
  "priority": "medium",
  "severity": "normal",
  "tags": [
    "regression",
    "api"
  ],
  "objective": "The search endpoint validates its required parameter.",
  "preconditions": "None",
  "steps": [
    {
      "action": "Send search request without the search_product parameter",
      "data": "POST /api/searchProduct with empty body",
      "expectedResult": "responseCode 400 and message 'Bad request, search_product parameter is missing in POST request.'"
    }
  ],
  "automation": {
    "status": "automated",
    "test": "qa.tests.api.ProductsApiTest#searchWithoutTermIsBadRequest"
  }
}
